Image_Links, Names, Short_Description, For_More_Info
https://m.media-amazon.com/images/M/MV5BMjAwMjk3NDUzN15BMl5BanBnXkFtZTcwNjI4MTY0NA@@._V1_UX140_CR00140209_AL_.jpg ,  Aamir Khan , Aamir is no doubt one of the most dedicated actors in this world. With , https://en.wikipedia.org/wiki/ Aamir Khan
https://m.media-amazon.com/images/M/MV5BODI4NDY1NzkyM15BMl5BanBnXkFtZTgwNzM3MDM0OTE@._V1_UY209_CR130140209_AL_.jpg ,  Akshay Kumar , Akshay Kumar born September 9 1967 is an actor. He studied martial  , https://en.wikipedia.org/wiki/ Akshay Kumar
https://m.media-amazon.com/images/M/MV5BMTY0MDY2MDMwOV5BMl5BanBnXkFtZTgwNDE4MDM0OTE@._V1_UY209_CR60140209_AL_.jpg ,  Ajay Devgn , Ajay Devgn is an Indian film actor director and producer. He made hi , https://en.wikipedia.org/wiki/ Ajay Devgn
https://m.media-amazon.com/images/M/MV5BOWUzNjU3YTUtOGIyMi00MDk3LTk1NDMtMzY4MDZlNDFhNTFhXkEyXkFqcGdeQXVyMTExNDQ2MTI@._V1_UY209_CR730140209_AL_.jpg ,  Amjad Khan , Amjad Khan was born on November 12 1940 in Hyderabad Hyderabad State , https://en.wikipedia.org/wiki/ Amjad Khan
https://m.media-amazon.com/images/M/MV5BNTk1OTUxMzIzMV5BMl5BanBnXkFtZTcwMzMxMjI0Nw@@._V1_UY209_CR60140209_AL_.jpg ,  Amitabh Bachchan , Son of well known poet Harivansh Rai Bachchan and Teji Bachchan. He ha , https://en.wikipedia.org/wiki/ Amitabh Bachchan
https://m.media-amazon.com/images/M/MV5BNzZhNDQ1YzItNTVlOC00MmVmLTkzMjEtMDFmN2Q0MDU2YmQ3XkEyXkFqcGdeQXVyMTExNDQ2MTI@._V1_UY209_CR210140209_AL_.jpg ,  Amol Palekar , Amol Palekar was born on November 24 1944 in Bombay Bombay Presidenc , https://en.wikipedia.org/wiki/ Amol Palekar
https://m.media-amazon.com/images/M/MV5BMTU2NzkzODA3OV5BMl5BanBnXkFtZTcwMzk2MDMyOA@@._V1_UX140_CR00140209_AL_.jpg ,  Abhay Deol , Abhay Deol (born in 1976 India) is an Indian film actor. He is the ne , https://en.wikipedia.org/wiki/ Abhay Deol
https://m.media-amazon.com/images/M/MV5BMjAxNDQyNDkxM15BMl5BanBnXkFtZTcwNTQyNTA0MQ@@._V1_UY209_CR870140209_AL_.jpg ,  Akshaye Khanna , Akshaye Khanna was born in Mumbai in 1975. He is the middle son of Bol , https://en.wikipedia.org/wiki/ Akshaye Khanna
https://m.media-amazon.com/images/M/MV5BNmMwOGYwMjUtN2M5My00ODIxLWI3ZjctODM2MGI4OGQzOWM0XkEyXkFqcGdeQXVyMTExNDQ2MTI@._V1_UY209_CR60140209_AL_.jpg ,  Arshad Warsi , Arshad Warsi was born in Mumbai India and did his schooling at a boa , https://en.wikipedia.org/wiki/ Arshad Warsi
https://m.media-amazon.com/images/M/MV5BZTkxYmU1NmUtNGE4Ni00OWNmLWE5YzktNTJiZTlmMTIyMTM5XkEyXkFqcGdeQXVyMTExNDQ2MTI@._V1_UY209_CR10140209_AL_.jpg ,  Anushka Shetty , Anushka Shetty is an Indian Film Actress. She was also a Yoga Instruct , https://en.wikipedia.org/wiki/ Anushka Shetty
https://m.media-amazon.com/images/M/MV5BY2E1ODI1MGUtYWY1ZS00ZDdlLTg0ZDctNWU1NmJhM2UxYzU5XkEyXkFqcGdeQXVyMjkxNzQ1NDI@._V1_UY209_CR00140209_AL_.jpg ,  Atul Kulkarni , Atul Kulkarni was born on September 10 1965 in Karnataka India. He i , https://en.wikipedia.org/wiki/ Atul Kulkarni
https://m.media-amazon.com/images/M/MV5BMjEyNDQ4MzUzNF5BMl5BanBnXkFtZTgwNjY3OTczOTE@._V1_UX140_CR00140209_AL_.jpg ,  Asrani , Asrani was born in a middle class Sindhi family. His father migrated t , https://en.wikipedia.org/wiki/ Asrani
https://m.media-amazon.com/images/M/MV5BOTk4MDY4ODAwNl5BMl5BanBnXkFtZTcwNzQ0MjY2Nw@@._V1_UY209_CR870140209_AL_.jpg ,  Ayushmann Khurrana , Ayushmann Khurrana was born on 14 September 1984 in Chandigarh India. , https://en.wikipedia.org/wiki/ Ayushmann Khurrana
https://m.media-amazon.com/images/M/MV5BYWIzYjZkZTAtNDM0MS00YjBiLWJlMjItZDY1YTJhNjMxNTExXkEyXkFqcGdeQXVyNDUzOTQ5MjY@._V1_UX140_CR00140209_AL_.jpg ,  Aruna Irani , Aruna Irani made her debut in the movie Gunga Jumna (1961) at nine yea , https://en.wikipedia.org/wiki/ Aruna Irani
https://m.media-amazon.com/images/M/MV5BMjE4MjAxODk1NV5BMl5BanBnXkFtZTcwODQ0MjY2Nw@@._V1_UY209_CR870140209_AL_.jpg ,  Annu Kapoor , Annu Kapoor made his debut in the film Mandi directed by Shyam Benegal , https://en.wikipedia.org/wiki/ Annu Kapoor
https://m.media-amazon.com/images/M/MV5BMzk5Mzc5Y2YtYjJjYy00OGIyLTg4MzctZTMxNDBiYzY2MTcxXkEyXkFqcGdeQXVyNjc0MTQwOTc@._V1_UY209_CR1160140209_AL_.jpg ,  Ashish Vidyarthi , Ashish Vidyarthi was born on June 19 1962 in Tellicherry Kerala Ind , https://en.wikipedia.org/wiki/ Ashish Vidyarthi
https://m.media-amazon.com/images/M/MV5BN2Q2YzA4MDMtMzVkYy00ZTMwLTgzN2EtZTc4NTRiODhkNzM3XkEyXkFqcGdeQXVyMjA4ODEzMzE@._V1_UY209_CR170140209_AL_.jpg ,  Adil Hussain , Adil Hussain is known for his critically acclaimed performances in awa , https://en.wikipedia.org/wiki/ Adil Hussain
https://m.media-amazon.com/images/M/MV5BMjMyMjc1OTgzNF5BMl5BanBnXkFtZTgwMDY1NDMzOTE@._V1_UY209_CR30140209_AL_.jpg ,  Anupam Kher , Anupam Kher was born on March 7 1955 in Shimla Himachal Pradesh Ind , https://en.wikipedia.org/wiki/ Anupam Kher
https://m.media-amazon.com/images/M/MV5BMjUyMWE5MjUtMDlkMC00ODc0LThkOTgtNjZhNDgyMTU5ZDhlXkEyXkFqcGdeQXVyMTExNDQ2MTI@._V1_UX140_CR00140209_AL_.jpg ,  Anil Kapoor , Living in a Chawl in Tilak Nagar Punjabi-speaking Anil was born in 19 , https://en.wikipedia.org/wiki/ Anil Kapoor
https://m.media-amazon.com/images/M/MV5BYWRlMTk2NWYtYjhjNy00NmRjLTg4NWMtMmM2YjJlN2YwNWE4XkEyXkFqcGdeQXVyMTExNDQ2MTI@._V1_UY209_CR80140209_AL_.jpg ,  Amrish Puri , Believe it or not Amrish Puri wanted to become a Bollywood movie hero , https://en.wikipedia.org/wiki/ Amrish Puri
https://m.media-amazon.com/images/M/MV5BZmNhMWQyOGYtYmZkMy00ZjdjLWE4N2QtYjc0NzEyZjViZWQzXkEyXkFqcGdeQXVyMTExNDQ2MTI@._V1_UY209_CR110140209_AL_.jpg ,  Amole Gupte , Amole Gupte is an Indian screenwriter actor and director known for  , https://en.wikipedia.org/wiki/ Amole Gupte
https://m.media-amazon.com/images/M/MV5BNTc4ZjFlMjUtODU3MS00M2JhLTlkMzEtMmIyODFiMjAwZmJhXkEyXkFqcGdeQXVyNTE0MDc0NTM@._V1_UY209_CR620140209_AL_.jpg ,  Boman Irani , Boman Irani was born on December 2 1959 in Bombay State of Bombay I , https://en.wikipedia.org/wiki/ Boman Irani
https://m.media-amazon.com/images/M/MV5BZDgwMGMzMWUtMmQ1Yi00NjM0LTlkMDgtMTk5MmFkMWJhNDY1XkEyXkFqcGdeQXVyMTExNDQ2MTI@._V1_UY209_CR100140209_AL_.jpg ,  Balraj Sahni , Balraj Sahni was born on May 1 1913 in Rawalpindi Punjab British In , https://en.wikipedia.org/wiki/ Balraj Sahni
https://m.media-amazon.com/images/G/01/imdb/images/nopicture/medium/name-2135195744._CB466677935_.png ,  Binnu Dhillon , Binnu Dhillon is an actor and producer known for Dev.D (2009) Vadhay , https://en.wikipedia.org/wiki/ Binnu Dhillon
https://m.media-amazon.com/images/M/MV5BODIwNGY2OGItN2I4Ny00Y2ExLWEzZmQtMTI0M2IxMWQxYTU5XkEyXkFqcGdeQXVyNDUzOTQ5MjY@._V1_UY209_CR20140209_AL_.jpg ,  Bharat Bhushan , Bharat Bhushan was born on June 14 1920 in Meerut United Provinces o , https://en.wikipedia.org/wiki/ Bharat Bhushan
https://m.media-amazon.com/images/M/MV5BOGQ4MTc3MWYtNmUxNi00Nzk3LWFjMDItM2Y1NmVmMDEyNWIxXkEyXkFqcGdeQXVyMTExNDQ2MTI@._V1_UY209_CR30140209_AL_.jpg ,  Chiranjeevi , This Telugu Star was a student at the Madras Film Institute and an ama , https://en.wikipedia.org/wiki/ Chiranjeevi
https://m.media-amazon.com/images/M/MV5BMTk5NjI3MTEwNF5BMl5BanBnXkFtZTgwMzU2MTMzOTE@._V1_UX140_CR00140209_AL_.jpg ,  Chunky Pandey , Chunky Pandey was born in Bombay India on September 26 1962 in a non , https://en.wikipedia.org/wiki/ Chunky Pandey
https://m.media-amazon.com/images/M/MV5BMzI4Njg3OTcyNF5BMl5BanBnXkFtZTcwNzQzMTYxOA@@._V1_UY209_CR110140209_AL_.jpg ,  Danny Denzongpa , Danny who married Gawa Denzongpa a Sikkimese princess and niece of t , https://en.wikipedia.org/wiki/ Danny Denzongpa
https://m.media-amazon.com/images/M/MV5BMjYyYzViMmYtMjU4Yi00NGM3LWFjZTEtZmFkOGFmOTllY2I2XkEyXkFqcGdeQXVyMTExNDQ2MTI@._V1_UY209_CR40140209_AL_.jpg ,  Darsheel Safary , Born in the same city and on the same month as his family friend Aamir , https://en.wikipedia.org/wiki/ Darsheel Safary
https://m.media-amazon.com/images/M/MV5BNmIwYzhiNjUtYmY3NS00YjdhLTlkM2UtZDJhZDJiNDkzNDI5XkEyXkFqcGdeQXVyNDY2Nzg2NQ@@._V1_UY209_CR340140209_AL_.jpg ,  Deepak Tijori , Deepak Tijori was born on August 28 1961 in Bombay Maharashtra Indi , https://en.wikipedia.org/wiki/ Deepak Tijori
https://m.media-amazon.com/images/M/MV5BMTk0ODU5NjAzMl5BMl5BanBnXkFtZTcwNDYyOTM5NA@@._V1_UY209_CR870140209_AL_.jpg ,  Dharmendra , Dharmendra is one of the biggest stars of Indian cinema. Dharmendra De , https://en.wikipedia.org/wiki/ Dharmendra
https://m.media-amazon.com/images/M/MV5BNGFlYzAyYjgtNzRjNS00NmE4LTliOGYtYzBkYzU5MzRhMDM0XkEyXkFqcGdeQXVyMTExNDQ2MTI@._V1_UX140_CR00140209_AL_.jpg ,  Deepika Padukone , Deepika Padukone born 5 January 1986 in Copenhagen Denmark is an In , https://en.wikipedia.org/wiki/ Deepika Padukone
https://m.media-amazon.com/images/M/MV5BNTc4MTE1NDU5MF5BMl5BanBnXkFtZTcwNDI2MTcxOA@@._V1_UY209_CR810140209_AL_.jpg ,  Dimple Kapadia , Born in a Gujerati-speaking family on June 8 1957 daughter to busine , https://en.wikipedia.org/wiki/ Dimple Kapadia
https://m.media-amazon.com/images/M/MV5BMTk5MDI0OTQzOF5BMl5BanBnXkFtZTcwMTgwMzEzMQ@@._V1_UY209_CR690140209_AL_.jpg ,  Dev Anand , After having played the Lead Actor for more than five decades in over  , https://en.wikipedia.org/wiki/ Dev Anand
https://m.media-amazon.com/images/M/MV5BYjhjNWM1MmUtM2M3My00MWZmLWE5NDYtNTI5YTM3MWQwNGVhXkEyXkFqcGdeQXVyNDUzOTQ5MjY@._V1_UX140_CR00140209_AL_.jpg ,  Deepti Naval , Deepti Naval is an Indian film actor director writer painter and ph , https://en.wikipedia.org/wiki/ Deepti Naval
https://m.media-amazon.com/images/M/MV5BMzg0NTM0MjYxN15BMl5BanBnXkFtZTcwMzY1NTAzMQ@@._V1_UY209_CR680140209_AL_.jpg ,  Dilip Kumar , Dilip Kumar is considered to be one of the greatest actors of Indian c , https://en.wikipedia.org/wiki/ Dilip Kumar
https://m.media-amazon.com/images/M/MV5BNzY3ODZmNDctZDA0ZC00NGNmLTgzZmItM2JhMTI4MzM3NTU2XkEyXkFqcGdeQXVyMTExNDQ2MTI@._V1_UY209_CR00140209_AL_.jpg ,  Farooq Shaikh , Farooq Sheikh was an Indian actor philanthropist and a television pre , https://en.wikipedia.org/wiki/ Farooq Shaikh
https://m.media-amazon.com/images/M/MV5BMjA4MjYwNzAzM15BMl5BanBnXkFtZTcwMzUyMTUxNw@@._V1_UX140_CR00140209_AL_.jpg ,  Farhan Akhtar , An accomplished and award-winning producer-director-writer-actor-singe , https://en.wikipedia.org/wiki/ Farhan Akhtar
https://m.media-amazon.com/images/M/MV5BN2NjODM2NDItYTU0Ni00MzJmLWJkZTYtMjQ3ZDZjZmNjY2NhXkEyXkFqcGdeQXVyMTExNDQ2MTI@._V1_UY209_CR80140209_AL_.jpg ,  Feroz Khan , Firoz was born in Bangalore on September 25 1939 to a Pathan father  , https://en.wikipedia.org/wiki/ Feroz Khan
https://m.media-amazon.com/images/M/MV5BZGE2OTUzZDEtZWQ2Ny00YTQ0LWEyYmItYmRiYjMxNTFiYzYwXkEyXkFqcGdeQXVyNDUzOTQ5MjY@._V1_UX140_CR00140209_AL_.jpg ,  Farida Jalal , Farida Jalal was discovered by Filmfare's United Producers' Talent Hun , https://en.wikipedia.org/wiki/ Farida Jalal
https://m.media-amazon.com/images/M/MV5BMjA0Mzg2NjEwN15BMl5BanBnXkFtZTgwODQ1NDQzNzE@._V1_UY209_CR690140209_AL_.jpg ,  Guru Dutt , Considered to be a man ahead of his time Guru Dutt was one of the gre , https://en.wikipedia.org/wiki/ Guru Dutt
https://m.media-amazon.com/images/M/MV5BNzEwNDgwMTk3Nl5BMl5BanBnXkFtZTgwNjMwOTU4MDI@._V1_UY209_CR140140209_AL_.jpg ,  Govinda , Govinda was born on December 21 1963. Govinda has acted in over 120 f , https://en.wikipedia.org/wiki/ Govinda
https://m.media-amazon.com/images/M/MV5BM2FmZGY4NDctMzczOC00MTg3LWExZDUtYWU5NTNkMTA4YzZhXkEyXkFqcGdeQXVyODI0MDE3OQ@@._V1_UX140_CR00140209_AL_.jpg ,  Gulshan Grover , Gulshan Grover was born raised and educated in Delhi India. After re , https://en.wikipedia.org/wiki/ Gulshan Grover
https://m.media-amazon.com/images/M/MV5BODJhZWQ3NGEtZDFmYS00YTc3LTllMzctZGFlM2U0NjliYTczXkEyXkFqcGdeQXVyMTExNDQ2MTI@._V1_UY209_CR60140209_AL_.jpg ,  Gurpreet Ghuggi , Gurpreet Ghuggi was born as Gurpreet Singh. He is known for his work o , https://en.wikipedia.org/wiki/ Gurpreet Ghuggi
https://m.media-amazon.com/images/M/MV5BMTkyNDk3MjEzN15BMl5BanBnXkFtZTYwOTQyODEz._V1_UY209_CR160140209_AL_.jpg ,  Girish Karnad , Girish Karnad was born on 19th May 1938 in Matheran Maharashtra. He i , https://en.wikipedia.org/wiki/ Girish Karnad
https://m.media-amazon.com/images/M/MV5BZjYwYjE4YjQtMTFmMi00NTlhLThjZjUtZTIyMTczMGU2ZDE5XkEyXkFqcGdeQXVyNzM2NzM0NDU@._V1_UX140_CR00140209_AL_.jpg ,  Hrithik Roshan , Hrithik Roshan is an Indian actor born on 10th January 1974 well kno , https://en.wikipedia.org/wiki/ Hrithik Roshan
https://m.media-amazon.com/images/M/MV5BMTEwMTkyMDY3OTheQTJeQWpwZ15BbWU4MDE1MjEyMzkx._V1_UX140_CR00140209_AL_.jpg ,  Huma Qureshi , Huma Qureshi born and raised in Delhi. Her father is a famous restaura , https://en.wikipedia.org/wiki/ Huma Qureshi
https://m.media-amazon.com/images/M/MV5BNTlkNmU1N2YtZGI2OC00YjkwLWIxM2MtNTZkMmJkYTQ4YWE1XkEyXkFqcGdeQXVyMjQwMDg0Ng@@._V1_UY209_CR100140209_AL_.jpg ,  Inaamulhaq , An alumnus of National School of Drama Inaamulhaq was born on Nov 14 , https://en.wikipedia.org/wiki/ Inaamulhaq
https://m.media-amazon.com/images/M/MV5BNDg3NDgxNzY4NF5BMl5BanBnXkFtZTcwODMxODQzMg@@._V1_UY209_CR80140209_AL_.jpg ,  Irrfan Khan , Born Sahabzade Irfan Ali Khan in Jaipur Rajasthan (NW India) January , https://en.wikipedia.org/wiki/ Irrfan Khan
https://m.media-amazon.com/images/M/MV5BYzczOGViODMtMWY1Yi00ZTAwLTkzZjItYzlmMzU0NmM5YjBmXkEyXkFqcGdeQXVyMjYwMDk5NjE@._V1_UY209_CR160140209_AL_.jpg ,  Jackie Shroff , Jaikishen was born in the Gujarati-speaking Shroff family on February  , https://en.wikipedia.org/wiki/ Jackie Shroff
https://m.media-amazon.com/images/M/MV5BMjM2MTc1NTk5OF5BMl5BanBnXkFtZTgwOTI4NDczMDE@._V1_UY209_CR860140209_AL_.jpg ,  Jimmy Sheirgill , Shergill was born in a Sikh family in Gorakhpur Uttar Pradesh. He mov , https://en.wikipedia.org/wiki/ Jimmy Sheirgill
https://m.media-amazon.com/images/M/MV5BYThkMTY3NDktMDBiNy00NWFhLWIyOWEtNGRkNDRiMGJjMjZiXkEyXkFqcGdeQXVyMTExNDQ2MTI@._V1_UY209_CR50140209_AL_.jpg ,  Jeetendra , Ravi Kapoor was born in a business family that dealt with imitation Je , https://en.wikipedia.org/wiki/ Jeetendra
https://m.media-amazon.com/images/M/MV5BZGQzZDgxNGMtZTdjYy00NzI3LThlOGItNjdmOTc5ZjQwYjcwXkEyXkFqcGdeQXVyNDAzNDk0MTQ@._V1_UY209_CR120140209_AL_.jpg ,  Jaspal Bhatti , al Bhatti the most popular social satirist in India graduated from P , https://en.wikipedia.org/wiki/ Jaspal Bhatti
https://m.media-amazon.com/images/M/MV5BMjMyMTQzMjk1MV5BMl5BanBnXkFtZTgwMDg5MTMzOTE@._V1_UX140_CR00140209_AL_.jpg ,  Johnny Lever , Johnny Lever born in Andhra Pradesh and was brought up in Mumbai's Ki , https://en.wikipedia.org/wiki/ Johnny Lever
https://m.media-amazon.com/images/G/01/imdb/images/nopicture/medium/name-2135195744._CB466677935_.png ,  Jaswinder Bhalla , Jaswinder Bhalla is an actor and writer known for Carry on Jatta (201 , https://en.wikipedia.org/wiki/ Jaswinder Bhalla
https://m.media-amazon.com/images/M/MV5BYmUxNTY0MWItODQ2My00YWMyLWFmODgtNTY1MTQ2ZjEwYzdlXkEyXkFqcGdeQXVyMjYwMDk5NjE@._V1_UY209_CR130140209_AL_.jpg ,  Kamal Haasan , Kamal Haasan was born November 7 1954 in Paramakudi Tamil Nadu. He d , https://en.wikipedia.org/wiki/ Kamal Haasan
https://m.media-amazon.com/images/M/MV5BMTA2NTg0ODA1ODJeQTJeQWpwZ15BbWU4MDM0NDkxNTMy._V1_UY209_CR40140209_AL_.jpg ,  Kangana Ranaut , Kangana was born on 20 March 1987 in Bhambla near Manali which is in , https://en.wikipedia.org/wiki/ Kangana Ranaut
https://m.media-amazon.com/images/M/MV5BMTU1NjUxNDYwNV5BMl5BanBnXkFtZTgwOTU3MDM0OTE@._V1_UY209_CR30140209_AL_.jpg ,  Konkona Sen Sharma , Konkona Sen Sharma is an awarding winning actress and the daughter of  , https://en.wikipedia.org/wiki/ Konkona Sen Sharma
https://m.media-amazon.com/images/M/MV5BNWYzY2QzNzUtYmVlYy00MmZjLTgxYjEtNjQyOWI5MzZkMDk4XkEyXkFqcGdeQXVyMTExNDQ2MTI@._V1_UY209_CR80140209_AL_.jpg ,  Kader Khan , Kader Khan was born on December 11 1937 in Pishin Balochistan Briti , https://en.wikipedia.org/wiki/ Kader Khan
https://m.media-amazon.com/images/M/MV5BMTY4MjgwODk4MF5BMl5BanBnXkFtZTgwNzAxNzE0MjE@._V1_UY209_CR870140209_AL_.jpg ,  Kay Kay Menon , Kay Kay Menon was born on October 2 1966 in Kerala India as Krishna  , https://en.wikipedia.org/wiki/ Kay Kay Menon
https://m.media-amazon.com/images/M/MV5BMjIwMjQ5MTQ4N15BMl5BanBnXkFtZTgwOTIyMDU0OTE@._V1_UY209_CR40140209_AL_.jpg ,  Kajol , Kajol was born on August 5 1974 in Bombay Maharashtra India as Kajo , https://en.wikipedia.org/wiki/ Kajol
https://m.media-amazon.com/images/M/MV5BMTQ2ODU1NDM0MF5BMl5BanBnXkFtZTcwNjIzNTE3Mw@@._V1_UY209_CR720140209_AL_.jpg ,  Kulbhushan Kharbanda , Kulbhushan Kharbanda was born on October 21 1944 in Hasan Abdal Punj , https://en.wikipedia.org/wiki/ Kulbhushan Kharbanda
https://m.media-amazon.com/images/M/MV5BNzI4NDQyMjU2MF5BMl5BanBnXkFtZTgwMzc4ODEzOTE@._V1_UX140_CR00140209_AL_.jpg ,  Kalki Koechlin , Kalki Koechlin was born to French parents in a small village in Pondic , https://en.wikipedia.org/wiki/ Kalki Koechlin
https://m.media-amazon.com/images/M/MV5BMjE5NzI3NjE1Ml5BMl5BanBnXkFtZTgwNTMxMjMzOTE@._V1_UY209_CR870140209_AL_.jpg ,  Kapil Sharma , Kapil Sharma is an Indian stand-up comedian TV anchor and singer.He w , https://en.wikipedia.org/wiki/ Kapil Sharma
https://m.media-amazon.com/images/M/MV5BOWJmNDJkYjEtYmY5ZC00NmY5LTgyNTUtN2FjODQyZGZhNmIzL2ltYWdlXkEyXkFqcGdeQXVyMTExNDQ2MTI@._V1_UY209_CR100140209_AL_.jpg ,  Krishna Abhishek , Krishna Abhishek is an actor and producer known for Bol Bachchan (201 , https://en.wikipedia.org/wiki/ Krishna Abhishek
https://m.media-amazon.com/images/M/MV5BMTg1MzAzMDg0OV5BMl5BanBnXkFtZTgwMjYzMTI1NTE@._V1_UY209_CR740140209_AL_.jpg ,  Karuna Bannerjee , Karuna Bannerjee was born on December 25 1919 in Calcutta Bengal Pre , https://en.wikipedia.org/wiki/ Karuna Bannerjee
https://m.media-amazon.com/images/M/MV5BZGRkNmZiYjItYTk5Yy00ODU1LThkNjAtYWQ4OGZjYTMxMDcwXkEyXkFqcGdeQXVyMTExNDQ2MTI@._V1_UY209_CR40140209_AL_.jpg ,  Kanwaljit Singh , Kanwaljit Singh is an actor known for 15 Park Avenue (2005) Bang Ban , https://en.wikipedia.org/wiki/ Kanwaljit Singh
https://m.media-amazon.com/images/M/MV5BNDk2OTk5NjYwNl5BMl5BanBnXkFtZTcwMzMyMDQ4Mg@@._V1_UY209_CR880140209_AL_.jpg ,  Lara Dutta , It is not a secret that Lara Dutta is a beauty with brains. This was d , https://en.wikipedia.org/wiki/ Lara Dutta
https://m.media-amazon.com/images/M/MV5BNWY2N2E4Y2EtOGI2NS00YjkxLTgwMDAtNGU4MTZjN2RiZjAwXkEyXkFqcGdeQXVyMTExNDQ2MTI@._V1_UY209_CR10140209_AL_.jpg ,  Manjot Singh , Manjot Singh is an Indian born actor whose portrayal of young Lucky in , https://en.wikipedia.org/wiki/ Manjot Singh
https://m.media-amazon.com/images/M/MV5BMmY4YzA5Y2UtYmI2Yi00MzNmLWJmZjQtYTY3YWYyYzBjYWQ3XkEyXkFqcGdeQXVyOTAyMDgxODQ@._V1_UY209_CR1150140209_AL_.jpg ,  Manu Rishi Chadha , Manu Rishi Chadha one of the finest artists in our industry was born  , https://en.wikipedia.org/wiki/ Manu Rishi Chadha
https://m.media-amazon.com/images/M/MV5BMzI0OWZlOTQtNGJiNS00YzVhLWE1MGQtZGY3ZWUwYWJiOTZiXkEyXkFqcGdeQXVyMTExNDQ2MTI@._V1_UY209_CR140140209_AL_.jpg ,  Mehmood , Mehmood was born on September 29 1932 in Bombay Bombay Presidency B , https://en.wikipedia.org/wiki/ Mehmood
https://m.media-amazon.com/images/M/MV5BMjAxNzA0MzkzNl5BMl5BanBnXkFtZTcwNjMyOTM0MQ@@._V1_UY209_CR890140209_AL_.jpg ,  Mukesh Tiwari , Mukesh Tiwari was born on August 24 1969 in Sagar Madhya Pradesh In , https://en.wikipedia.org/wiki/ Mukesh Tiwari
https://m.media-amazon.com/images/M/MV5BOTFjOGIwMmUtY2FlMS00ZWJlLThhOWItY2RmY2JmYTc0YTk5XkEyXkFqcGdeQXVyMjYwMDk5NjE@._V1_UX140_CR00140209_AL_.jpg ,  Mammootty , Malayalam film actor Mammootty was born to Ismail (an agriculturist) a , https://en.wikipedia.org/wiki/ Mammootty
https://m.media-amazon.com/images/M/MV5BNDcyOGU3ODctZjZiZi00OWY1LWEzYjktOTIxNTUwMTAyODMzXkEyXkFqcGdeQXVyMjkxNzQ1NDI@._V1_UY209_CR00140209_AL_.jpg ,  Makrand Deshpande , Makrand Deshpande was born on July 3 1958 in India. He is an actor an , https://en.wikipedia.org/wiki/ Makrand Deshpande
https://m.media-amazon.com/images/M/MV5BZjQ4NWIwYzYtOTYwZC00ZDI4LWFmYWEtZjhmNTE3ODVhYzJkXkEyXkFqcGdeQXVyOTc1MzM5MA@@._V1_UY209_CR80140209_AL_.jpg ,  Madhavan , Madhavan was born on June 1 1970 in a Tamil-speaking family.At the a , https://en.wikipedia.org/wiki/ Madhavan
https://m.media-amazon.com/images/M/MV5BYjFjZGRjMWYtZTA5MS00OTZkLWI1MjctNDQ2NmQzMWM1NzRhXkEyXkFqcGdeQXVyMjkxNzQ1NDI@._V1_UY209_CR00140209_AL_.jpg ,  Mohanlal , Mohanlal was born to Viswanathan Nair (father) and Santhakumari (mothe , https://en.wikipedia.org/wiki/ Mohanlal
https://m.media-amazon.com/images/M/MV5BNGQ4YjkyMzMtM2E4OS00YmMzLWEyY2YtYjY0ZmUzYmEzNzFiXkEyXkFqcGdeQXVyNDUzOTQ5MjY@._V1_UY209_CR130140209_AL_.jpg ,  Mita Vasisht , Mita Vashisht is an Indian television film and theater actress who g , https://en.wikipedia.org/wiki/ Mita Vasisht
https://m.media-amazon.com/images/M/MV5BMzUxODk5MmEtZGQxOC00NzUxLWI5YTEtYWFjMjZmZTIwNTA5XkEyXkFqcGdeQXVyMTExNDQ2MTI@._V1_UY209_CR80140209_AL_.jpg ,  Manoj Bajpayee , Manoj Bajpayee was born on April 23 1969 in Belwa Bihar India. He i , https://en.wikipedia.org/wiki/ Manoj Bajpayee
https://m.media-amazon.com/images/M/MV5BMDdmMDUzMGUtNjBiYy00ZDdiLTlhZWItYmE3MjNjNGViM2U0XkEyXkFqcGdeQXVyMTExNDQ2MTI@._V1_UY209_CR20140209_AL_.jpg ,  Manoj Joshi , Manoj Joshi is an India film and television actor. Joshi began his car , https://en.wikipedia.org/wiki/ Manoj Joshi
https://m.media-amazon.com/images/M/MV5BNTk0OTFkZGItYTQxMi00YTUwLTlkMGEtMTIyZDNlNDc0MzRlXkEyXkFqcGdeQXVyMTgzNTY5OTc@._V1_UY209_CR340140209_AL_.jpg ,  Madhuri Dixit , Madhuri Dixit is one of the most acclaimed actors and Kathak dancers B , https://en.wikipedia.org/wiki/ Madhuri Dixit
https://m.media-amazon.com/images/M/MV5BZWRlMmFiZWUtYWY3Ni00NDkwLWFlZmQtOWE2NjI2MDUzYTczXkEyXkFqcGdeQXVyMTExNDQ2MTI@._V1_UY209_CR40140209_AL_.jpg ,  Mohnish Bahl , Mohnish Bahl was born on February 14 1963 in Bombay Maharashtra Ind , https://en.wikipedia.org/wiki/ Mohnish Bahl
https://m.media-amazon.com/images/M/MV5BMjQwNDUxMzY4Ml5BMl5BanBnXkFtZTgwMTgxMTIzOTE@._V1_UY209_CR60140209_AL_.jpg ,  Mithun Chakraborty , Mithun Chakraborty was born on June 16 1947 in Barisal Bengal Presid , https://en.wikipedia.org/wiki/ Mithun Chakraborty
https://m.media-amazon.com/images/M/MV5BMTYwNTk2MTk4MF5BMl5BanBnXkFtZTgwODQ1ODA0OTE@._V1_UY209_CR900140209_AL_.jpg ,  Mukesh Khanna , Mukesh Khanna was born on July 19 1958 in Bombay State of Bombay In , https://en.wikipedia.org/wiki/ Mukesh Khanna
https://m.media-amazon.com/images/M/MV5BODhjYmUzZTctNWY3Yy00ZDBmLTk0NzEtMzg3YzlhYzA0NGI2XkEyXkFqcGdeQXVyMTExNDQ2MTI@._V1_UY209_CR60140209_AL_.jpg ,  Mukul Dev , Mukul Dev was born on November 30 1970 in Delhi India. He is an acto , https://en.wikipedia.org/wiki/ Mukul Dev
https://m.media-amazon.com/images/M/MV5BMTI4MTAzMzc2MV5BMl5BanBnXkFtZTcwMDkyNDAzMQ@@._V1_UY209_CR110140209_AL_.jpg ,  Madhubala , Arguably the most beautiful artiste to ever grace the Indian screen M , https://en.wikipedia.org/wiki/ Madhubala
https://m.media-amazon.com/images/M/MV5BMTM2NjQ1Nzg2N15BMl5BanBnXkFtZTcwNDkyNjAzMQ@@._V1_UY209_CR10140209_AL_.jpg ,  Meena Kumari , Born 1933 into a poor Parsee theatre family of Ali Bux and dancer Iqba , https://en.wikipedia.org/wiki/ Meena Kumari
https://m.media-amazon.com/images/M/MV5BMWUyNzlkMDEtMGY4My00M2QwLWEzYjktMzk1YjliNDhiYzc5XkEyXkFqcGdeQXVyNDUzOTQ5MjY@._V1_UY209_CR60140209_AL_.jpg ,  Mala Sinha , Mala Sinha was born on November 11 1936 in Calcutta Bengal Presidenc , https://en.wikipedia.org/wiki/ Mala Sinha
https://m.media-amazon.com/images/M/MV5BMDM4MTY3YzAtYmJlMC00YjdjLTg4YzgtZTJiMzI5NzJjODg2XkEyXkFqcGdeQXVyMTExNDQ2MTI@._V1_UY209_CR40140209_AL_.jpg ,  Manoj Pahwa , Manoj Pahwa is an actor known for Article 15 (2019) Mulk (2018) and  , https://en.wikipedia.org/wiki/ Manoj Pahwa
https://m.media-amazon.com/images/M/MV5BMzUxNTM4MzQ4N15BMl5BanBnXkFtZTgwMjY1ODA0OTE@._V1_UY209_CR340140209_AL_.jpg ,  Manoj Kumar , Manoj Kumar was born on July 24 1937 in Abbottabad North-West Fronti , https://en.wikipedia.org/wiki/ Manoj Kumar
https://m.media-amazon.com/images/M/MV5BMjA3Njc5NjcwOF5BMl5BanBnXkFtZTcwMTgyOTY0OA@@._V1_UY209_CR870140209_AL_.jpg ,  Nassar , Nassar is one of the most acclaimed actors in India. He is the current , https://en.wikipedia.org/wiki/ Nassar
https://m.media-amazon.com/images/M/MV5BMTQ4MDcyOTExOV5BMl5BanBnXkFtZTgwOTQyMDU0OTE@._V1_UY209_CR120140209_AL_.jpg ,  Naseeruddin Shah , Naseeruddin Shah was born on July 20 1950 in Barabanki Uttar Pradesh , https://en.wikipedia.org/wiki/ Naseeruddin Shah
https://m.media-amazon.com/images/M/MV5BMTA2NzUwMTAxMDBeQTJeQWpwZ15BbWU4MDQ0MTEyNTEx._V1_UY209_CR00140209_AL_.jpg ,  Nandita Das , Nandita Das was born on November 7 1969 in Delhi India. She is known , https://en.wikipedia.org/wiki/ Nandita Das
https://m.media-amazon.com/images/M/MV5BMDE5ZTgzN2QtODQzMi00NzYxLWI3ZmMtMzAxNWM0OGM1YjM0XkEyXkFqcGdeQXVyNzc4NzEwNTc@._V1_UY209_CR820140209_AL_.jpg ,  Nagarjuna Akkineni , Nagarjuna did his schooling at Hyderabad Public School and later went  , https://en.wikipedia.org/wiki/ Nagarjuna Akkineni
https://m.media-amazon.com/images/M/MV5BMjI4MzQyODYwOF5BMl5BanBnXkFtZTgwMTcxMTIzOTE@._V1_UY209_CR870140209_AL_.jpg ,  Nana Patekar , Vishwanath Patekar (born on January 1 1951 in Murud-Janjira Maharash , https://en.wikipedia.org/wiki/ Nana Patekar
https://m.media-amazon.com/images/M/MV5BMTU5NTQwMTI0NV5BMl5BanBnXkFtZTcwNzQyNTgxOA@@._V1_UX140_CR00140209_AL_.jpg ,  Nawazuddin Siddiqui , Nawazuddin Siddiqui (born 1974) also known as Nowaz is an Indian film  , https://en.wikipedia.org/wiki/ Nawazuddin Siddiqui
https://m.media-amazon.com/images/M/MV5BMTY1NzE0ODkzNl5BMl5BanBnXkFtZTcwMDQ2OTAzMQ@@._V1_UY209_CR50140209_AL_.jpg ,  Nargis , She was born on June 1 1929 as Fatima Rashid in Rawalpindi British I , https://en.wikipedia.org/wiki/ Nargis
https://m.media-amazon.com/images/M/MV5BNGYxMTdjY2MtMDkzYS00ZGJlLTljZTgtYjlhZGVhYTNhMTE3XkEyXkFqcGdeQXVyNDUzOTQ5MjY@._V1_UY209_CR70140209_AL_.jpg ,  Nirupa Roy , Kokila was born on January 4 1931 in Valsad Gujarat India in the G , https://en.wikipedia.org/wiki/ Nirupa Roy
